{
  "name": "jerry-framework",
  "version": "1.0.0",
  "description": "Jerry Framework - Claude Code plugin for behavior and workflow guardrails with knowledge accrual",
  "owner": {
    "name": "Jerry Framework Contributors",
    "email": "geekatron@gmail.com"
  },
  "plugins": [
    {
      "name": "jerry",
      "description": "Behavior and workflow guardrails with knowledge accrual for Claude Code. 12 skills and 58 specialized agents covering problem-solving, work tracking, systems engineering, orchestration, adversarial quality review, secure engineering, offensive security, and transcript parsing.",
      "source": "./",
      "version": "0.23.0",
      "category": "productivity",
      "keywords": ["problem-solving", "work-tracking", "knowledge-management", "agents", "workflows"]
    }
  ]
}
